<?xml version="1.0" encoding="utf-8"?>
<ps:Config xmlns:ps="urn:Microsoft.SharePoint.PowerShell"
                     xmlns:xsi="http://www.w3.org/2001/XMLSchema-instance"
                     xsi:schemaLocation="urn:Microsoft.SharePoint.PowerShell  SPCmdletSchema.xsd">
  <ps:Assembly Name="Microsoft.Office.InfoPath.Server, Version=16.0.0.0, Culture=neutral, PublicKeyToken=71e9bce111e9429c">
    <ps:Cmdlet>
      <ps:VerbName>Get-SPInfoPathFormsService</ps:VerbName>
      <ps:ClassName>Microsoft.Office.InfoPath.Server.Cmdlet.GetFormsServiceCmdlet</ps:ClassName>
      <ps:HelpFile>Microsoft.Office.InfoPath.Server.dll-help.xml</ps:HelpFile>
    </ps:Cmdlet>
    <ps:Cmdlet>
      <ps:VerbName>Set-SPInfoPathFormsService</ps:VerbName>
      <ps:ClassName>Microsoft.Office.InfoPath.Server.Cmdlet.SetFormsServiceCmdlet</ps:ClassName>
      <ps:HelpFile>Microsoft.Office.InfoPath.Server.dll-help.xml</ps:HelpFile>
    </ps:Cmdlet>
    <ps:Cmdlet>
      <ps:VerbName>Get-SPInfoPathFormTemplate</ps:VerbName>
      <ps:ClassName>Microsoft.Office.InfoPath.Server.Cmdlet.GetFormTemplateCmdlet</ps:ClassName>
      <ps:HelpFile>Microsoft.Office.InfoPath.Server.dll-help.xml</ps:HelpFile>
    </ps:Cmdlet>
    <ps:Cmdlet>
      <ps:VerbName>Set-SPInfoPathFormTemplate</ps:VerbName>
      <ps:ClassName>Microsoft.Office.InfoPath.Server.Cmdlet.SetFormTemplateCmdlet</ps:ClassName>
      <ps:HelpFile>Microsoft.Office.InfoPath.Server.dll-help.xml</ps:HelpFile>
    </ps:Cmdlet>
    <ps:Cmdlet>
      <ps:VerbName>Install-SPInfoPathFormTemplate</ps:VerbName>
      <ps:ClassName>Microsoft.Office.InfoPath.Server.Cmdlet.InstallFormTemplateCmdlet</ps:ClassName>
      <ps:HelpFile>Microsoft.Office.InfoPath.Server.dll-help.xml</ps:HelpFile>
      <ps:FeatureDependencyId>A10B6AA4-135D-4598-88D1-8D4FF5691D13</ps:FeatureDependencyId>
    </ps:Cmdlet>
    <ps:Cmdlet>
      <ps:VerbName>Uninstall-SPInfoPathFormTemplate</ps:VerbName>
      <ps:ClassName>Microsoft.Office.InfoPath.Server.Cmdlet.UninstallFormTemplateCmdlet</ps:ClassName>
      <ps:HelpFile>Microsoft.Office.InfoPath.Server.dll-help.xml</ps:HelpFile>
      <ps:FeatureDependencyId>A10B6AA4-135D-4598-88D1-8D4FF5691D13</ps:FeatureDependencyId>
    </ps:Cmdlet>
    <ps:Cmdlet>
      <ps:VerbName>Enable-SPInfoPathFormTemplate</ps:VerbName>
      <ps:ClassName>Microsoft.Office.InfoPath.Server.Cmdlet.EnableFormTemplateCmdlet</ps:ClassName>
      <ps:HelpFile>Microsoft.Office.InfoPath.Server.dll-help.xml</ps:HelpFile>
      <ps:FeatureDependencyId>A10B6AA4-135D-4598-88D1-8D4FF5691D13</ps:FeatureDependencyId>
    </ps:Cmdlet>
    <ps:Cmdlet>
      <ps:VerbName>Disable-SPInfoPathFormTemplate</ps:VerbName>
      <ps:ClassName>Microsoft.Office.InfoPath.Server.Cmdlet.DisableFormTemplateCmdlet</ps:ClassName>
      <ps:HelpFile>Microsoft.Office.InfoPath.Server.dll-help.xml</ps:HelpFile>
      <ps:FeatureDependencyId>A10B6AA4-135D-4598-88D1-8D4FF5691D13</ps:FeatureDependencyId>
    </ps:Cmdlet>
    <ps:Cmdlet>
      <ps:VerbName>Start-SPInfoPathFormTemplate</ps:VerbName>
      <ps:ClassName>Microsoft.Office.InfoPath.Server.Cmdlet.StartFormTemplateCmdlet</ps:ClassName>
      <ps:HelpFile>Microsoft.Office.InfoPath.Server.dll-help.xml</ps:HelpFile>
    </ps:Cmdlet>
    <ps:Cmdlet>
      <ps:VerbName>Stop-SPInfoPathFormTemplate</ps:VerbName>
      <ps:ClassName>Microsoft.Office.InfoPath.Server.Cmdlet.StopFormTemplateCmdlet</ps:ClassName>
      <ps:HelpFile>Microsoft.Office.InfoPath.Server.dll-help.xml</ps:HelpFile>
    </ps:Cmdlet>
    <ps:Cmdlet>
      <ps:VerbName>Update-SPInfoPathFormTemplate</ps:VerbName>
      <ps:ClassName>Microsoft.Office.InfoPath.Server.Cmdlet.UpdateFormTemplateCmdlet</ps:ClassName>
      <ps:HelpFile>Microsoft.Office.InfoPath.Server.dll-help.xml</ps:HelpFile>
    </ps:Cmdlet>
    <ps:Cmdlet>
      <ps:VerbName>Test-SPInfoPathFormTemplate</ps:VerbName>
      <ps:ClassName>Microsoft.Office.InfoPath.Server.Cmdlet.TestFormTemplateCmdlet</ps:ClassName>
      <ps:HelpFile>Microsoft.Office.InfoPath.Server.dll-help.xml</ps:HelpFile>
    </ps:Cmdlet>
    <ps:Cmdlet>
      <ps:VerbName>Get-SPDataConnectionFile</ps:VerbName>
      <ps:ClassName>Microsoft.Office.InfoPath.Server.Cmdlet.GetDataConnectionFileCmdlet</ps:ClassName>
      <ps:HelpFile>Microsoft.Office.InfoPath.Server.dll-help.xml</ps:HelpFile>
    </ps:Cmdlet>
    <ps:Cmdlet>
      <ps:VerbName>Set-SPDataConnectionFile</ps:VerbName>
      <ps:ClassName>Microsoft.Office.InfoPath.Server.Cmdlet.SetDataConnectionFileCmdlet</ps:ClassName>
      <ps:HelpFile>Microsoft.Office.InfoPath.Server.dll-help.xml</ps:HelpFile>
    </ps:Cmdlet>
    <ps:Cmdlet>
      <ps:VerbName>Install-SPDataConnectionFile</ps:VerbName>
      <ps:ClassName>Microsoft.Office.InfoPath.Server.Cmdlet.InstallDataConnectionFileCmdlet</ps:ClassName>
      <ps:HelpFile>Microsoft.Office.InfoPath.Server.dll-help.xml</ps:HelpFile>
    </ps:Cmdlet>
    <ps:Cmdlet>
      <ps:VerbName>Uninstall-SPDataConnectionFile</ps:VerbName>
      <ps:ClassName>Microsoft.Office.InfoPath.Server.Cmdlet.UninstallDataConnectionFileCmdlet</ps:ClassName>
      <ps:HelpFile>Microsoft.Office.InfoPath.Server.dll-help.xml</ps:HelpFile>
    </ps:Cmdlet>
    <ps:Cmdlet>
      <ps:VerbName>Get-SPDataConnectionFileDependent</ps:VerbName>
      <ps:ClassName>Microsoft.Office.InfoPath.Server.Cmdlet.GetDataConnectionFileDependentCmdlet</ps:ClassName>
      <ps:HelpFile>Microsoft.Office.InfoPath.Server.dll-help.xml</ps:HelpFile>
    </ps:Cmdlet>
    <ps:Cmdlet>
      <ps:VerbName>Get-SPInfoPathWebServiceProxy</ps:VerbName>
      <ps:ClassName>Microsoft.Office.InfoPath.Server.Cmdlet.GetWebServiceProxyCmdlet</ps:ClassName>
      <ps:HelpFile>Microsoft.Office.InfoPath.Server.dll-help.xml</ps:HelpFile>
    </ps:Cmdlet>
    <ps:Cmdlet>
      <ps:VerbName>Set-SPInfoPathWebServiceProxy</ps:VerbName>
      <ps:ClassName>Microsoft.Office.InfoPath.Server.Cmdlet.SetWebServiceProxyCmdlet</ps:ClassName>
      <ps:HelpFile>Microsoft.Office.InfoPath.Server.dll-help.xml</ps:HelpFile>
    </ps:Cmdlet>
    <ps:Cmdlet>
      <ps:VerbName>Get-SPInfoPathUserAgent</ps:VerbName>
      <ps:ClassName>Microsoft.Office.InfoPath.Server.Cmdlet.GetUserAgentCmdlet</ps:ClassName>
      <ps:HelpFile>Microsoft.Office.InfoPath.Server.dll-help.xml</ps:HelpFile>
    </ps:Cmdlet>
    <ps:Cmdlet>
      <ps:VerbName>Add-SPInfoPathUserAgent</ps:VerbName>
      <ps:ClassName>Microsoft.Office.InfoPath.Server.Cmdlet.AddUserAgentCmdlet</ps:ClassName>
      <ps:HelpFile>Microsoft.Office.InfoPath.Server.dll-help.xml</ps:HelpFile>
    </ps:Cmdlet>
    <ps:Cmdlet>
      <ps:VerbName>Remove-SPInfoPathUserAgent</ps:VerbName>
      <ps:ClassName>Microsoft.Office.InfoPath.Server.Cmdlet.RemoveUserAgentCmdlet</ps:ClassName>
      <ps:HelpFile>Microsoft.Office.InfoPath.Server.dll-help.xml</ps:HelpFile>
    </ps:Cmdlet>
    <ps:Cmdlet>
      <ps:VerbName>Update-SPInfoPathAdminFileUrl</ps:VerbName>
      <ps:ClassName>Microsoft.Office.InfoPath.Server.RepairUtilities.UpdateInfoPathAdminFileUrlCmdlet</ps:ClassName>
      <ps:HelpFile>Microsoft.Office.InfoPath.Server.dll-help.xml</ps:HelpFile>
    </ps:Cmdlet>
    <ps:Cmdlet>
      <ps:VerbName>Export-SPInfoPathAdministrationFiles</ps:VerbName>
      <ps:ClassName>Microsoft.Office.InfoPath.Server.Cmdlet.ExportFormsServiceAdminFiles</ps:ClassName>
      <ps:HelpFile>Microsoft.Office.InfoPath.Server.dll-help.xml</ps:HelpFile>
    </ps:Cmdlet>
    <ps:Cmdlet>
      <ps:VerbName>Import-SPInfoPathAdministrationFiles</ps:VerbName>
      <ps:ClassName>Microsoft.Office.InfoPath.Server.Cmdlet.ImportFormsServiceAdminFiles</ps:ClassName>
      <ps:HelpFile>Microsoft.Office.InfoPath.Server.dll-help.xml</ps:HelpFile>
    </ps:Cmdlet>
  </ps:Assembly>
</ps:Config>
