<?xml version='1.0'?>
<!-- Copyright (c) Microsoft Corporation. All rights reserved. -->
<ps:Config xmlns:ps="urn:Microsoft.SharePoint.PowerShell"
			xmlns:xsi="http://www.w3.org/2001/XMLSchema-instance"
			xsi:schemaLocation="urn:Microsoft.SharePoint.PowerShell SPCmdletSchema.xsd">
	<ps:Assembly Name="Microsoft.Office.Access.Services.Moss, Version=16.0.0.0, Culture=neutral, PublicKeyToken=71e9bce111e9429c">
		<ps:Cmdlet>
			<ps:VerbName>Get-SPAccessServicesApplication</ps:VerbName>
			<ps:ClassName>Microsoft.Office.Access.Services.PowerShell.GetSPAccessServicesApplication</ps:ClassName>
			<ps:HelpFile>microsoft.office.access.server.dll-help.xml</ps:HelpFile>
			<ps:FeatureDependencyId>5094E988-524B-446c-B2F6-040B5BE46297</ps:FeatureDependencyId>
		</ps:Cmdlet>
		<ps:Cmdlet>
			<ps:VerbName>Set-SPAccessServicesApplication</ps:VerbName>
			<ps:ClassName>Microsoft.Office.Access.Services.PowerShell.SetSPAccessServicesApplication</ps:ClassName>
			<ps:HelpFile>microsoft.office.access.server.dll-help.xml</ps:HelpFile>
			<ps:FeatureDependencyId>5094E988-524B-446c-B2F6-040B5BE46297</ps:FeatureDependencyId>
		</ps:Cmdlet>
		<ps:Cmdlet>
			<ps:VerbName>New-SPAccessServicesApplication</ps:VerbName>
			<ps:ClassName>Microsoft.Office.Access.Services.PowerShell.NewSPAccessServicesApplication</ps:ClassName>
			<ps:HelpFile>microsoft.office.access.server.dll-help.xml</ps:HelpFile>
			<ps:FeatureDependencyId>5094E988-524B-446c-B2F6-040B5BE46297</ps:FeatureDependencyId>
		</ps:Cmdlet>
		<ps:Cmdlet>
			<ps:VerbName>New-SPAccessServicesApplicationProxy</ps:VerbName>
			<ps:ClassName>Microsoft.Office.Access.Services.PowerShell.NewSPAccessServicesApplicationProxy</ps:ClassName>
			<ps:HelpFile>microsoft.office.access.server.dll-help.xml</ps:HelpFile>
			<ps:FeatureDependencyId>5094E988-524B-446c-B2F6-040B5BE46297</ps:FeatureDependencyId>
		</ps:Cmdlet>
		<ps:Cmdlet>
			<ps:VerbName>Get-SPAccessServicesDatabaseServer</ps:VerbName>
			<ps:ClassName>Microsoft.Office.Access.Services.PowerShell.GetSPAccessServicesDatabaseServer</ps:ClassName>
			<ps:HelpFile>microsoft.office.access.server.dll-help.xml</ps:HelpFile>
			<ps:FeatureDependencyId>5094E988-524B-446c-B2F6-040B5BE46297</ps:FeatureDependencyId>
		</ps:Cmdlet>
		<ps:Cmdlet>
			<ps:VerbName>New-SPAccessServicesDatabaseServer</ps:VerbName>
			<ps:ClassName>Microsoft.Office.Access.Services.PowerShell.NewSPAccessServicesDatabaseServer</ps:ClassName>
			<ps:HelpFile>microsoft.office.access.server.dll-help.xml</ps:HelpFile>
			<ps:FeatureDependencyId>5094E988-524B-446c-B2F6-040B5BE46297</ps:FeatureDependencyId>
		</ps:Cmdlet>
		<ps:Cmdlet>
			<ps:VerbName>Set-SPAccessServicesDatabaseServer</ps:VerbName>
			<ps:ClassName>Microsoft.Office.Access.Services.PowerShell.SetSPAccessServicesDatabaseServer</ps:ClassName>
			<ps:HelpFile>microsoft.office.access.server.dll-help.xml</ps:HelpFile>
			<ps:FeatureDependencyId>5094E988-524B-446c-B2F6-040B5BE46297</ps:FeatureDependencyId>
		</ps:Cmdlet>
		<ps:Cmdlet>
			<ps:VerbName>Get-SPAccessServicesDatabase</ps:VerbName>
			<ps:ClassName>Microsoft.Office.Access.Services.PowerShell.GetSPAccessServicesDatabase</ps:ClassName>
			<ps:HelpFile>microsoft.office.access.server.dll-help.xml</ps:HelpFile>
			<ps:FeatureDependencyId>5094E988-524B-446c-B2F6-040B5BE46297</ps:FeatureDependencyId>
		</ps:Cmdlet>
		<ps:Cmdlet>
			<ps:VerbName>Reset-SPAccessServicesDatabasePassword</ps:VerbName>
			<ps:ClassName>Microsoft.Office.Access.Services.PowerShell.ResetSPAccessServicesDatabasePassword</ps:ClassName>
			<ps:HelpFile>microsoft.office.access.server.dll-help.xml</ps:HelpFile>
			<ps:FeatureDependencyId>5094E988-524B-446c-B2F6-040B5BE46297</ps:FeatureDependencyId>
		</ps:Cmdlet>
		<ps:Cmdlet>
			<ps:VerbName>Get-SPAccessServicesDatabaseServerGroup</ps:VerbName>
			<ps:ClassName>Microsoft.Office.Access.Services.PowerShell.GetSPAccessServicesDatabaseServerGroup</ps:ClassName>
			<ps:HelpFile>microsoft.office.access.server.dll-help.xml</ps:HelpFile>
			<ps:FeatureDependencyId>5094E988-524B-446c-B2F6-040B5BE46297</ps:FeatureDependencyId>
		</ps:Cmdlet>
		<ps:Cmdlet>
			<ps:VerbName>Get-SPAccessServicesDatabaseServerGroupMapping</ps:VerbName>
			<ps:ClassName>Microsoft.Office.Access.Services.PowerShell.GetSPAccessServicesDatabaseServerGroupMapping</ps:ClassName>
			<ps:HelpFile>microsoft.office.access.server.dll-help.xml</ps:HelpFile>
			<ps:FeatureDependencyId>5094E988-524B-446c-B2F6-040B5BE46297</ps:FeatureDependencyId>
		</ps:Cmdlet>
		<ps:Cmdlet>
			<ps:VerbName>Set-SPAccessServicesDatabaseServerGroupMapping</ps:VerbName>
			<ps:ClassName>Microsoft.Office.Access.Services.PowerShell.SetSPAccessServicesDatabaseServerGroupMapping</ps:ClassName>
			<ps:HelpFile>microsoft.office.access.server.dll-help.xml</ps:HelpFile>
			<ps:FeatureDependencyId>5094E988-524B-446c-B2F6-040B5BE46297</ps:FeatureDependencyId>
		</ps:Cmdlet>
		<ps:Cmdlet>
			<ps:VerbName>Remove-SPAccessServicesDatabaseServer</ps:VerbName>
			<ps:ClassName>Microsoft.Office.Access.Services.PowerShell.RemoveSPAccessServicesDatabaseServer</ps:ClassName>
			<ps:HelpFile>microsoft.office.access.server.dll-help.xml</ps:HelpFile>
			<ps:FeatureDependencyId>5094E988-524B-446c-B2F6-040B5BE46297</ps:FeatureDependencyId>
		</ps:Cmdlet>
		<ps:Cmdlet>
			<ps:VerbName>Copy-SPAccessServicesDatabaseCredentials</ps:VerbName>
			<ps:ClassName>Microsoft.Office.Access.Services.PowerShell.CopySPAccessServicesDatabaseCredentials</ps:ClassName>
			<ps:HelpFile>microsoft.office.access.server.dll-help.xml</ps:HelpFile>
			<ps:FeatureDependencyId>5094E988-524B-446c-B2F6-040B5BE46297</ps:FeatureDependencyId>
		</ps:Cmdlet>
		<ps:Cmdlet>
			<ps:VerbName>Import-SPAccessServicesDatabase</ps:VerbName>
			<ps:ClassName>Microsoft.Office.Access.Services.PowerShell.ImportSPAccessServicesDatabase</ps:ClassName>
			<ps:HelpFile>microsoft.office.access.server.dll-help.xml</ps:HelpFile>
			<ps:FeatureDependencyId>5094E988-524B-446c-B2F6-040B5BE46297</ps:FeatureDependencyId>
		</ps:Cmdlet>
		<ps:Cmdlet>
			<ps:VerbName>Export-SPAccessServicesDatabase</ps:VerbName>
			<ps:ClassName>Microsoft.Office.Access.Services.PowerShell.ExportSPAccessServicesDatabase</ps:ClassName>
			<ps:HelpFile>microsoft.office.access.server.dll-help.xml</ps:HelpFile>
			<ps:FeatureDependencyId>5094E988-524B-446c-B2F6-040B5BE46297</ps:FeatureDependencyId>
		</ps:Cmdlet>
	</ps:Assembly>
</ps:Config>
