<?xml version="1.0" encoding="utf-8"?>
<ps:Config xmlns:ps="urn:Microsoft.SharePoint.PowerShell"
                     xmlns:xsi="http://www.w3.org/2001/XMLSchema-instance"
                     xsi:schemaLocation="urn:Microsoft.SharePoint.PowerShell  SPCmdletSchema.xsd">
  <ps:Assembly Name="Microsoft.Office.Server, Version=16.0.0.0, Culture=neutral, PublicKeyToken=71e9bce111e9429c">

    <ps:Cmdlet>
      <ps:VerbName>Get-SPSessionStateService</ps:VerbName>
      <ps:ClassName>Microsoft.Office.Server.Administration.GetSessionStateServiceCmdlet</ps:ClassName>
      <ps:HelpFile>Microsoft.Office.Server.dll-help.xml</ps:HelpFile>
    </ps:Cmdlet>
    <ps:Cmdlet>
      <ps:VerbName>Set-SPSessionStateService</ps:VerbName>
      <ps:ClassName>Microsoft.Office.Server.Administration.SetSessionStateServiceCmdlet</ps:ClassName>
      <ps:HelpFile>Microsoft.Office.Server.dll-help.xml</ps:HelpFile>
    </ps:Cmdlet>
    <ps:Cmdlet>
      <ps:VerbName>Enable-SPSessionStateService</ps:VerbName>
      <ps:ClassName>Microsoft.Office.Server.Administration.EnableSessionStateServiceCmdlet</ps:ClassName>
      <ps:HelpFile>Microsoft.Office.Server.dll-help.xml</ps:HelpFile>
    </ps:Cmdlet>
    <ps:Cmdlet>
      <ps:VerbName>Disable-SPSessionStateService</ps:VerbName>
      <ps:ClassName>Microsoft.Office.Server.Administration.DisableSessionStateServiceCmdlet</ps:ClassName>
      <ps:HelpFile>Microsoft.Office.Server.dll-help.xml</ps:HelpFile>
    </ps:Cmdlet>

    <ps:Cmdlet>
      <ps:VerbName>New-SPStateServiceApplication</ps:VerbName>
      <ps:ClassName>Microsoft.Office.Server.Administration.NewStateServiceApplicationCmdlet</ps:ClassName>
      <ps:HelpFile>Microsoft.Office.Server.dll-help.xml</ps:HelpFile>
    </ps:Cmdlet>
    <ps:Cmdlet>
      <ps:VerbName>Get-SPStateServiceApplication</ps:VerbName>
      <ps:ClassName>Microsoft.Office.Server.Administration.GetStateServiceApplicationCmdlet</ps:ClassName>
      <ps:HelpFile>Microsoft.Office.Server.dll-help.xml</ps:HelpFile>
    </ps:Cmdlet>
    <ps:Cmdlet>
      <ps:VerbName>Set-SPStateServiceApplication</ps:VerbName>
      <ps:ClassName>Microsoft.Office.Server.Administration.SetStateServiceApplicationCmdlet</ps:ClassName>
      <ps:HelpFile>Microsoft.Office.Server.dll-help.xml</ps:HelpFile>
    </ps:Cmdlet>

    <ps:Cmdlet>
      <ps:VerbName>New-SPStateServiceApplicationProxy</ps:VerbName>
      <ps:ClassName>Microsoft.Office.Server.Administration.NewStateServiceApplicationProxyCmdlet</ps:ClassName>
      <ps:HelpFile>Microsoft.Office.Server.dll-help.xml</ps:HelpFile>
    </ps:Cmdlet>
    <ps:Cmdlet>
      <ps:VerbName>Get-SPStateServiceApplicationProxy</ps:VerbName>
      <ps:ClassName>Microsoft.Office.Server.Administration.GetStateServiceApplicationProxyCmdlet</ps:ClassName>
      <ps:HelpFile>Microsoft.Office.Server.dll-help.xml</ps:HelpFile>
    </ps:Cmdlet>
    <ps:Cmdlet>
      <ps:VerbName>Set-SPStateServiceApplicationProxy</ps:VerbName>
      <ps:ClassName>Microsoft.Office.Server.Administration.SetStateServiceApplicationProxyCmdlet</ps:ClassName>
      <ps:HelpFile>Microsoft.Office.Server.dll-help.xml</ps:HelpFile>
    </ps:Cmdlet>

    <ps:Cmdlet>
      <ps:VerbName>New-SPStateServiceDatabase</ps:VerbName>
      <ps:ClassName>Microsoft.Office.Server.Administration.NewStateServiceDatabaseCmdlet</ps:ClassName>
      <ps:HelpFile>Microsoft.Office.Server.dll-help.xml</ps:HelpFile>
    </ps:Cmdlet>
    <ps:Cmdlet>
      <ps:VerbName>Remove-SPStateServiceDatabase</ps:VerbName>
      <ps:ClassName>Microsoft.Office.Server.Administration.RemoveStateServiceDatabaseCmdlet</ps:ClassName>
      <ps:HelpFile>Microsoft.Office.Server.dll-help.xml</ps:HelpFile>
    </ps:Cmdlet>
    <ps:Cmdlet>
      <ps:VerbName>Get-SPStateServiceDatabase</ps:VerbName>
      <ps:ClassName>Microsoft.Office.Server.Administration.GetStateServiceDatabaseCmdlet</ps:ClassName>
      <ps:HelpFile>Microsoft.Office.Server.dll-help.xml</ps:HelpFile>
    </ps:Cmdlet>
    <ps:Cmdlet>
      <ps:VerbName>Set-SPStateServiceDatabase</ps:VerbName>
      <ps:ClassName>Microsoft.Office.Server.Administration.SetStateServiceDatabaseCmdlet</ps:ClassName>
      <ps:HelpFile>Microsoft.Office.Server.dll-help.xml</ps:HelpFile>
    </ps:Cmdlet>
    <ps:Cmdlet>
      <ps:VerbName>Mount-SPStateServiceDatabase</ps:VerbName>
      <ps:ClassName>Microsoft.Office.Server.Administration.MountStateServiceDatabaseCmdlet</ps:ClassName>
      <ps:HelpFile>Microsoft.Office.Server.dll-help.xml</ps:HelpFile>
    </ps:Cmdlet>
    <ps:Cmdlet>
      <ps:VerbName>Dismount-SPStateServiceDatabase</ps:VerbName>
      <ps:ClassName>Microsoft.Office.Server.Administration.DismountStateServiceDatabaseCmdlet</ps:ClassName>
      <ps:HelpFile>Microsoft.Office.Server.dll-help.xml</ps:HelpFile>
    </ps:Cmdlet>
    <ps:Cmdlet>
      <ps:VerbName>Initialize-SPStateServiceDatabase</ps:VerbName>
      <ps:ClassName>Microsoft.Office.Server.Administration.InitializeStateServiceDatabaseCmdlet</ps:ClassName>
      <ps:HelpFile>Microsoft.Office.Server.dll-help.xml</ps:HelpFile>
    </ps:Cmdlet>
    <ps:Cmdlet>
      <ps:VerbName>Suspend-SPStateServiceDatabase</ps:VerbName>
      <ps:ClassName>Microsoft.Office.Server.Administration.SuspendStateServiceDatabaseCmdlet</ps:ClassName>
      <ps:HelpFile>Microsoft.Office.Server.dll-help.xml</ps:HelpFile>
    </ps:Cmdlet>
    <ps:Cmdlet>
      <ps:VerbName>Resume-SPStateServiceDatabase</ps:VerbName>
      <ps:ClassName>Microsoft.Office.Server.Administration.ResumeStateServiceDatabaseCmdlet</ps:ClassName>
      <ps:HelpFile>Microsoft.Office.Server.dll-help.xml</ps:HelpFile>
    </ps:Cmdlet>
    <ps:Cmdlet>
      <ps:VerbName>Split-SPServerScaleOutDatabase</ps:VerbName>
      <ps:ClassName>Microsoft.Office.Server.Administration.SPCmdletSplitScaleOutDatabase</ps:ClassName>
      <ps:HelpFile>Microsoft.Office.Server.dll-help.xml</ps:HelpFile>
    </ps:Cmdlet>
    <ps:Cmdlet>
      <ps:VerbName>Get-SPServerScaleOutDatabaseDataState</ps:VerbName>
      <ps:ClassName>Microsoft.Office.Server.Administration.SPCmdletGetScaleOutDatabaseDataState</ps:ClassName>
      <ps:HelpFile>Microsoft.Office.Server.dll-help.xml</ps:HelpFile>
    </ps:Cmdlet>
    <ps:Cmdlet>
      <ps:VerbName>Set-SPServerScaleOutDatabaseDataSubRange</ps:VerbName>
      <ps:ClassName>Microsoft.Office.Server.Administration.SPCmdletSetScaleOutDatabaseDataSubRange</ps:ClassName>
      <ps:HelpFile>Microsoft.Office.Server.dll-help.xml</ps:HelpFile>
    </ps:Cmdlet>
    <ps:Cmdlet>
      <ps:VerbName>Set-SPServerScaleOutDatabaseDataRange</ps:VerbName>
      <ps:ClassName>Microsoft.Office.Server.Administration.SPCmdletSetScaleOutDatabaseDataRange</ps:ClassName>
      <ps:HelpFile>Microsoft.Office.Server.dll-help.xml</ps:HelpFile>
    </ps:Cmdlet>
    <ps:Cmdlet>
      <ps:VerbName>Clear-SPServerScaleOutDatabaseDeletedDataSubRange</ps:VerbName>
      <ps:ClassName>Microsoft.Office.Server.Administration.SPCmdletClearScaleOutDatabaseDeleteDataSubRange</ps:ClassName>
      <ps:HelpFile>Microsoft.Office.Server.dll-help.xml</ps:HelpFile>
    </ps:Cmdlet>
    <ps:Cmdlet>
      <ps:VerbName>Get-SPServerScaleOutDatabase</ps:VerbName>
      <ps:ClassName>Microsoft.Office.Server.Administration.SPCmdletGetScaleOutDatabase</ps:ClassName>
      <ps:HelpFile>Microsoft.Office.Server.dll-help.xml</ps:HelpFile>
    </ps:Cmdlet>
    <ps:Cmdlet>
      <ps:VerbName>Get-SPServerScaleOutDatabaseLogEntry</ps:VerbName>
      <ps:ClassName>Microsoft.Office.Server.Administration.SPCmdletGetScaleOutDatabaseLogEntry</ps:ClassName>
      <ps:HelpFile>Microsoft.Office.Server.dll-help.xml</ps:HelpFile>
    </ps:Cmdlet>
    <ps:Cmdlet>
      <ps:VerbName>Clear-SPServerScaleOutDatabaseLog</ps:VerbName>
      <ps:ClassName>Microsoft.Office.Server.Administration.SPCmdletClearScaleOutDatabaseLog</ps:ClassName>
      <ps:HelpFile>Microsoft.Office.Server.dll-help.xml</ps:HelpFile>
    </ps:Cmdlet>
    <ps:Cmdlet>
      <ps:VerbName>Get-SPServerScaleOutDatabaseInconsistency</ps:VerbName>
      <ps:ClassName>Microsoft.Office.Server.Administration.SPCmdletGetScaleOutDatabaseInconsistency</ps:ClassName>
      <ps:HelpFile>Microsoft.Office.Server.dll-help.xml</ps:HelpFile>
    </ps:Cmdlet>
    <ps:Cmdlet>
      <ps:VerbName>Export-SPServerScaleOutDatabaseTenantData</ps:VerbName>
      <ps:ClassName>Microsoft.Office.Server.Administration.SPCmdletScaleOutDatabaseTenantDataExport</ps:ClassName>
      <ps:HelpFile>Microsoft.Office.Server.dll-help.xml</ps:HelpFile>
    </ps:Cmdlet>
    <ps:Cmdlet>
      <ps:VerbName>Import-SPServerScaleOutDatabaseTenantData</ps:VerbName>
      <ps:ClassName>Microsoft.Office.Server.Administration.SPCmdletScaleOutDatabaseTenantDataImport</ps:ClassName>
      <ps:HelpFile>Microsoft.Office.Server.dll-help.xml</ps:HelpFile>
    </ps:Cmdlet>
    <ps:Cmdlet>
      <ps:VerbName>Clear-SPServerScaleOutDatabaseTenantData</ps:VerbName>
      <ps:ClassName>Microsoft.Office.Server.Administration.SPCmdletScaleOutDatabaseTenantDataClear</ps:ClassName>
      <ps:HelpFile>Microsoft.Office.Server.dll-help.xml</ps:HelpFile>
    </ps:Cmdlet>
    <ps:Cmdlet>
      <ps:VerbName>Add-SPServerScaleOutDatabase</ps:VerbName>
      <ps:ClassName>Microsoft.Office.Server.Administration.SPCmdletAddScaleOutDatabase</ps:ClassName>
      <ps:HelpFile>Microsoft.Office.Server.dll-help.xml</ps:HelpFile>
    </ps:Cmdlet>
    <ps:Cmdlet>
      <ps:VerbName>Remove-SPServerScaleOutDatabase</ps:VerbName>
      <ps:ClassName>Microsoft.Office.Server.Administration.SPCmdletRemoveScaleOutDatabase</ps:ClassName>
      <ps:HelpFile>Microsoft.Office.Server.dll-help.xml</ps:HelpFile>
    </ps:Cmdlet>
  </ps:Assembly>
</ps:Config>
