<?xml version='1.0'?>
<!-- Copyright (c) Microsoft Corporation. All rights reserved. -->
<ps:Config xmlns:ps="urn:Microsoft.SharePoint.PowerShell"
			xmlns:xsi="http://www.w3.org/2001/XMLSchema-instance"
			xsi:schemaLocation="urn:Microsoft.SharePoint.PowerShell SPCmdletSchema.xsd">
	<ps:Assembly Name="Microsoft.Office.Access.Server, Version=16.0.0.0, Culture=neutral, PublicKeyToken=71e9bce111e9429c">
		<ps:Cmdlet>
			<ps:VerbName>Get-SPAccessServiceApplication</ps:VerbName>
			<ps:ClassName>Microsoft.Office.Access.Server.PowerShell.GetSPAccessServiceApplication</ps:ClassName>
			<ps:HelpFile>microsoft.office.access.services.dll-help.xml</ps:HelpFile>
			<ps:FeatureDependencyId>1CC4B32C-299B-41aa-9770-67715EA05F25</ps:FeatureDependencyId>
		</ps:Cmdlet>
		<ps:Cmdlet>
			<ps:VerbName>Set-SPAccessServiceApplication</ps:VerbName>
			<ps:ClassName>Microsoft.Office.Access.Server.PowerShell.SetSPAccessServiceApplication</ps:ClassName>
			<ps:HelpFile>microsoft.office.access.services.dll-help.xml</ps:HelpFile>
			<ps:FeatureDependencyId>1CC4B32C-299B-41aa-9770-67715EA05F25</ps:FeatureDependencyId>
		</ps:Cmdlet>
		<ps:Cmdlet>
			<ps:VerbName>New-SPAccessServiceApplication</ps:VerbName>
			<ps:ClassName>Microsoft.Office.Access.Server.PowerShell.NewSPAccessServiceApplication</ps:ClassName>
			<ps:HelpFile>microsoft.office.access.services.dll-help.xml</ps:HelpFile>
			<ps:FeatureDependencyId>1CC4B32C-299B-41aa-9770-67715EA05F25</ps:FeatureDependencyId>
		</ps:Cmdlet>
	</ps:Assembly>
</ps:Config>
