<ps:Config xmlns:ps="urn:Microsoft.SharePoint.PowerShell"
                     xmlns:xsi="http://www.w3.org/2001/XMLSchema-instance"
                     xsi:schemaLocation="urn:Microsoft.SharePoint.PowerShell  SPCmdletSchema.xsd">

  <ps:Assembly Name="Microsoft.SharePoint.Taxonomy, Version=16.0.0.0, Culture=neutral, PublicKeyToken=71e9bce111e9429c">
    <ps:Cmdlet>
      <ps:VerbName>Get-SPTaxonomySession</ps:VerbName>
      <ps:ClassName>Microsoft.SharePoint.Taxonomy.Cmdlet.SPCmdletGetTaxonomySession</ps:ClassName>
      <ps:HelpFile>Microsoft.SharePoint.Taxonomy.dll-help.xml</ps:HelpFile>
    </ps:Cmdlet>
    <ps:Cmdlet>
      <ps:VerbName>New-SPMetadataServiceApplication</ps:VerbName>
      <ps:ClassName>Microsoft.SharePoint.Taxonomy.Cmdlet.SPCmdletNewMetadataService</ps:ClassName>
      <ps:HelpFile>Microsoft.SharePoint.Taxonomy.dll-help.xml</ps:HelpFile>
    </ps:Cmdlet>   
    <ps:Cmdlet>
      <ps:VerbName>Get-SPMetadataServiceApplication</ps:VerbName>
      <ps:ClassName>Microsoft.SharePoint.Taxonomy.Cmdlet.SPCmdletGetMetadataService</ps:ClassName>
      <ps:HelpFile>Microsoft.SharePoint.Taxonomy.dll-help.xml</ps:HelpFile>
    </ps:Cmdlet>    
    <ps:Cmdlet>
      <ps:VerbName>Set-SPMetadataServiceApplication</ps:VerbName>
      <ps:ClassName>Microsoft.SharePoint.Taxonomy.Cmdlet.SPCmdletSetMetadataService</ps:ClassName>
      <ps:HelpFile>Microsoft.SharePoint.Taxonomy.dll-help.xml</ps:HelpFile>
    </ps:Cmdlet>
    <ps:Cmdlet>
      <ps:VerbName>New-SPMetadataServiceApplicationProxy</ps:VerbName>
      <ps:ClassName>Microsoft.SharePoint.Taxonomy.Cmdlet.SPCmdletNewMetadataServiceProxy</ps:ClassName>
      <ps:HelpFile>Microsoft.SharePoint.Taxonomy.dll-help.xml</ps:HelpFile>
    </ps:Cmdlet>   
    <ps:Cmdlet>
      <ps:VerbName>Get-SPMetadataServiceApplicationProxy</ps:VerbName>
      <ps:ClassName>Microsoft.SharePoint.Taxonomy.Cmdlet.SPCmdletGetMetadataServiceProxy</ps:ClassName>
      <ps:HelpFile>Microsoft.SharePoint.Taxonomy.dll-help.xml</ps:HelpFile>
    </ps:Cmdlet>    
    <ps:Cmdlet>
      <ps:VerbName>Set-SPMetadataServiceApplicationProxy</ps:VerbName>
      <ps:ClassName>Microsoft.SharePoint.Taxonomy.Cmdlet.SPCmdletSetMetadataServiceProxy</ps:ClassName>
      <ps:HelpFile>Microsoft.SharePoint.Taxonomy.dll-help.xml</ps:HelpFile>
    </ps:Cmdlet>
    <ps:Cmdlet>
      <ps:VerbName>Export-SPMetadataWebServicePartitionData</ps:VerbName>
      <ps:ClassName>Microsoft.SharePoint.Taxonomy.Cmdlet.SPCmdletExportMetadataWebServicePartitionData</ps:ClassName>
      <ps:HelpFile>Microsoft.SharePoint.Taxonomy.dll-help.xml</ps:HelpFile>
    </ps:Cmdlet>
    <ps:Cmdlet>
      <ps:VerbName>Import-SPMetadataWebServicePartitionData</ps:VerbName>
      <ps:ClassName>Microsoft.SharePoint.Taxonomy.Cmdlet.SPCmdletImportMetadataWebServicePartitionData</ps:ClassName>
      <ps:HelpFile>Microsoft.SharePoint.Taxonomy.dll-help.xml</ps:HelpFile>
    </ps:Cmdlet>
    <ps:Cmdlet>
      <ps:VerbName>Clear-SPMetadataWebServicePartitionData</ps:VerbName>
      <ps:ClassName>Microsoft.SharePoint.Taxonomy.Cmdlet.SPCmdletClearMetadataWebServicePartitionData</ps:ClassName>
      <ps:HelpFile>Microsoft.SharePoint.Taxonomy.dll-help.xml</ps:HelpFile>
    </ps:Cmdlet>  
    <ps:Cmdlet>
      <ps:VerbName>Get-SPSiteSubscriptionMetadataConfig</ps:VerbName>
      <ps:ClassName>Microsoft.SharePoint.Taxonomy.Cmdlet.SPCmdletGetSiteSubscriptionMetadataConfig</ps:ClassName>
      <ps:HelpFile>Microsoft.SharePoint.Taxonomy.dll-help.xml</ps:HelpFile>
    </ps:Cmdlet>
    <ps:Cmdlet>
      <ps:VerbName>Remove-SPSiteSubscriptionMetadataConfig</ps:VerbName>
      <ps:ClassName>Microsoft.SharePoint.Taxonomy.Cmdlet.SPCmdletRemoveSiteSubscriptionMetadataConfig</ps:ClassName>
      <ps:HelpFile>Microsoft.SharePoint.Taxonomy.dll-help.xml</ps:HelpFile>
    </ps:Cmdlet>
    <ps:Cmdlet>
      <ps:VerbName>Set-SPSiteSubscriptionMetadataConfig</ps:VerbName>
      <ps:ClassName>Microsoft.SharePoint.Taxonomy.Cmdlet.SPCmdletSetSiteSubscriptionMetadataConfig</ps:ClassName>
      <ps:HelpFile>Microsoft.SharePoint.Taxonomy.dll-help.xml</ps:HelpFile>
    </ps:Cmdlet>    
    <ps:Cmdlet>
      <ps:VerbName>Copy-SPTaxonomyGroups</ps:VerbName>
      <ps:ClassName>Microsoft.SharePoint.Taxonomy.Hybrid.Cmdlet.SPCmdletMigrateSPTaxonomyGroups</ps:ClassName>
      <ps:HelpFile>Microsoft.SharePoint.Taxonomy.dll-help.xml</ps:HelpFile>
    </ps:Cmdlet>
    <ps:Cmdlet>
      <ps:VerbName>Stop-SPTaxonomyReplication</ps:VerbName>
      <ps:ClassName>Microsoft.SharePoint.Taxonomy.Hybrid.Cmdlet.SPCmdletStopSPTaxonomyReplication</ps:ClassName>
      <ps:HelpFile>Microsoft.SharePoint.Taxonomy.dll-help.xml</ps:HelpFile>
    </ps:Cmdlet>
    <ps:Cmdlet>
      <ps:VerbName>Copy-SPContentTypes</ps:VerbName>
      <ps:ClassName>Microsoft.SharePoint.Taxonomy.Hybrid.Cmdlet.SPCmdletMigrateSPContentTypes</ps:ClassName>
      <ps:HelpFile>Microsoft.SharePoint.Taxonomy.dll-help.xml</ps:HelpFile>
    </ps:Cmdlet>
    <ps:Cmdlet>
      <ps:VerbName>Stop-SPContentTypeReplication</ps:VerbName>
      <ps:ClassName>Microsoft.SharePoint.Taxonomy.Hybrid.Cmdlet.SPCmdletStopSPContentTypeReplication</ps:ClassName>
      <ps:HelpFile>Microsoft.SharePoint.Taxonomy.dll-help.xml</ps:HelpFile>
    </ps:Cmdlet>
  </ps:Assembly>
</ps:Config>
