<ps:Config xmlns:ps="urn:Microsoft.SharePoint.PowerShell"
                     xmlns:xsi="http://www.w3.org/2001/XMLSchema-instance"
                     xsi:schemaLocation="urn:Microsoft.SharePoint.PowerShell  SPCmdletSchema.xsd">

  <ps:Assembly Name="Microsoft.SharePoint.Publishing, Version=16.0.0.0, Culture=neutral, PublicKeyToken=71e9bce111e9429c">
    <ps:Cmdlet>
      <ps:VerbName>New-SPContentDeploymentPath</ps:VerbName>
      <ps:ClassName>Microsoft.SharePoint.Publishing.Cmdlet.SPCmdletNewContentDeploymentPath</ps:ClassName>
      <ps:HelpFile>Microsoft.SharePoint.Publishing.dll-help.xml</ps:HelpFile>
    </ps:Cmdlet>
    <ps:Cmdlet>
      <ps:VerbName>Get-SPContentDeploymentPath</ps:VerbName>
      <ps:ClassName>Microsoft.SharePoint.Publishing.Cmdlet.SPCmdletGetContentDeploymentPath</ps:ClassName>
      <ps:HelpFile>Microsoft.SharePoint.Publishing.dll-help.xml</ps:HelpFile>
    </ps:Cmdlet>
    <ps:Cmdlet>
      <ps:VerbName>Set-SPContentDeploymentPath</ps:VerbName>
      <ps:ClassName>Microsoft.SharePoint.Publishing.Cmdlet.SPCmdletSetContentDeploymentPath</ps:ClassName>
      <ps:HelpFile>Microsoft.SharePoint.Publishing.dll-help.xml</ps:HelpFile>
    </ps:Cmdlet>
    <ps:Cmdlet>
      <ps:VerbName>Remove-SPContentDeploymentPath</ps:VerbName>
      <ps:ClassName>Microsoft.SharePoint.Publishing.Cmdlet.SPCmdletRemoveContentDeploymentPath</ps:ClassName>
      <ps:HelpFile>Microsoft.SharePoint.Publishing.dll-help.xml</ps:HelpFile>
    </ps:Cmdlet>
    <ps:Cmdlet>
      <ps:VerbName>New-SPContentDeploymentJob</ps:VerbName>
      <ps:ClassName>Microsoft.SharePoint.Publishing.Cmdlet.SPCmdletNewContentDeploymentJob</ps:ClassName>
      <ps:HelpFile>Microsoft.SharePoint.Publishing.dll-help.xml</ps:HelpFile>
    </ps:Cmdlet>
    <ps:Cmdlet>
      <ps:VerbName>Get-SPContentDeploymentJob</ps:VerbName>
      <ps:ClassName>Microsoft.SharePoint.Publishing.Cmdlet.SPCmdletGetContentDeploymentJob</ps:ClassName>
      <ps:HelpFile>Microsoft.SharePoint.Publishing.dll-help.xml</ps:HelpFile>
    </ps:Cmdlet>
    <ps:Cmdlet>
      <ps:VerbName>Set-SPContentDeploymentJob</ps:VerbName>
      <ps:ClassName>Microsoft.SharePoint.Publishing.Cmdlet.SPCmdletSetContentDeploymentJob</ps:ClassName>
      <ps:HelpFile>Microsoft.SharePoint.Publishing.dll-help.xml</ps:HelpFile>
    </ps:Cmdlet>
    <ps:Cmdlet>
      <ps:VerbName>Start-SPContentDeploymentJob</ps:VerbName>
      <ps:ClassName>Microsoft.SharePoint.Publishing.Cmdlet.SPCmdletStartContentDeploymentJob</ps:ClassName>
      <ps:HelpFile>Microsoft.SharePoint.Publishing.dll-help.xml</ps:HelpFile>
    </ps:Cmdlet>
    <ps:Cmdlet>
      <ps:VerbName>Remove-SPContentDeploymentJob</ps:VerbName>
      <ps:ClassName>Microsoft.SharePoint.Publishing.Cmdlet.SPCmdletRemoveContentDeploymentJob</ps:ClassName>
      <ps:HelpFile>Microsoft.SharePoint.Publishing.dll-help.xml</ps:HelpFile>
    </ps:Cmdlet>
    <ps:Cmdlet>
      <ps:VerbName>Set-SPSiteSubscriptionEdiscoveryHub</ps:VerbName>
      <ps:ClassName>Microsoft.SharePoint.Publishing.Cmdlet.SPCmdletSetSiteSubscriptionEdiscoveryHub</ps:ClassName>
      <ps:HelpFile>Microsoft.SharePoint.Publishing.dll-help.xml</ps:HelpFile>
    </ps:Cmdlet>
     <ps:Cmdlet>
      <ps:VerbName>Get-SPSiteSubscriptionEdiscoveryHub</ps:VerbName>
      <ps:ClassName>Microsoft.SharePoint.Publishing.Cmdlet.SPCmdletGetSiteSubscriptionEdiscoveryHub</ps:ClassName>
      <ps:HelpFile>Microsoft.SharePoint.Publishing.dll-help.xml</ps:HelpFile>
    </ps:Cmdlet>
    <ps:Cmdlet>
      <ps:VerbName>Get-SPSiteSubscriptionEdiscoverySearchScope</ps:VerbName>
      <ps:ClassName>Microsoft.SharePoint.Publishing.Cmdlet.SPCmdletGetSiteSubscriptionEdiscoverySearchScope</ps:ClassName>
      <ps:HelpFile>Microsoft.SharePoint.Publishing.dll-help.xml</ps:HelpFile>
    </ps:Cmdlet>

  </ps:Assembly>
</ps:Config>
