<ps:Config xmlns:ps="urn:Microsoft.SharePoint.PowerShell"
                     xmlns:xsi="http://www.w3.org/2001/XMLSchema-instance"
                     xsi:schemaLocation="urn:Microsoft.SharePoint.PowerShell  SPCmdletSchema.xsd">
  <ps:Assembly Name="Microsoft.Office.Visio.Server, Version=16.0.0.0, Culture=neutral, PublicKeyToken=71e9bce111e9429c">
    <ps:Cmdlet>
      <ps:VerbName>Get-SPVisioPerformance</ps:VerbName>
      <ps:ClassName>Microsoft.Office.Visio.Server.Cmdlet.GetSPVisioPerformance</ps:ClassName>
      <ps:HelpFile>Microsoft.Office.Visio.Server.dll-help.xml</ps:HelpFile>
      <ps:FeatureDependencyId>5FE8E789-D1B7-44B3-B634-419C531CFDCA</ps:FeatureDependencyId>
    </ps:Cmdlet>
    <ps:Cmdlet>
      <ps:VerbName>Set-SPVisioPerformance</ps:VerbName>
      <ps:ClassName>Microsoft.Office.Visio.Server.Cmdlet.SetSPVisioPerformance</ps:ClassName>
      <ps:HelpFile>Microsoft.Office.Visio.Server.dll-help.xml</ps:HelpFile>
      <ps:FeatureDependencyId>5FE8E789-D1B7-44B3-B634-419C531CFDCA</ps:FeatureDependencyId>
    </ps:Cmdlet>
    <ps:Cmdlet>
      <ps:VerbName>Get-SPVisioExternalData</ps:VerbName>
      <ps:ClassName>Microsoft.Office.Visio.Server.Cmdlet.GetSPVisioExternalData</ps:ClassName>
      <ps:HelpFile>Microsoft.Office.Visio.Server.dll-help.xml</ps:HelpFile>
      <ps:FeatureDependencyId>5FE8E789-D1B7-44B3-B634-419C531CFDCA</ps:FeatureDependencyId>
    </ps:Cmdlet>
    <ps:Cmdlet>
      <ps:VerbName>Set-SPVisioExternalData</ps:VerbName>
      <ps:ClassName>Microsoft.Office.Visio.Server.Cmdlet.SetSPVisioExternalData</ps:ClassName>
      <ps:HelpFile>Microsoft.Office.Visio.Server.dll-help.xml</ps:HelpFile>
      <ps:FeatureDependencyId>5FE8E789-D1B7-44B3-B634-419C531CFDCA</ps:FeatureDependencyId>
    </ps:Cmdlet>
    <ps:Cmdlet>
      <ps:VerbName>Get-SPVisioSafeDataProvider</ps:VerbName>
      <ps:ClassName>Microsoft.Office.Visio.Server.Cmdlet.GetSPVisioSafeDataProvider</ps:ClassName>
      <ps:HelpFile>Microsoft.Office.Visio.Server.dll-help.xml</ps:HelpFile>
      <ps:FeatureDependencyId>5FE8E789-D1B7-44B3-B634-419C531CFDCA</ps:FeatureDependencyId>
    </ps:Cmdlet>
    <ps:Cmdlet>
      <ps:VerbName>Set-SPVisioSafeDataProvider</ps:VerbName>
      <ps:ClassName>Microsoft.Office.Visio.Server.Cmdlet.SetSPVisioSafeDataProvider</ps:ClassName>
      <ps:HelpFile>Microsoft.Office.Visio.Server.dll-help.xml</ps:HelpFile>
      <ps:FeatureDependencyId>5FE8E789-D1B7-44B3-B634-419C531CFDCA</ps:FeatureDependencyId>
    </ps:Cmdlet>
    <ps:Cmdlet>
      <ps:VerbName>Remove-SPVisioSafeDataProvider</ps:VerbName>
      <ps:ClassName>Microsoft.Office.Visio.Server.Cmdlet.RemoveSPVisioSafeDataProvider</ps:ClassName>
      <ps:HelpFile>Microsoft.Office.Visio.Server.dll-help.xml</ps:HelpFile>
      <ps:FeatureDependencyId>5FE8E789-D1B7-44B3-B634-419C531CFDCA</ps:FeatureDependencyId>
    </ps:Cmdlet>
    <ps:Cmdlet>
      <ps:VerbName>New-SPVisioSafeDataProvider</ps:VerbName>
      <ps:ClassName>Microsoft.Office.Visio.Server.Cmdlet.NewSPVisioSafeDataProvider</ps:ClassName>
      <ps:HelpFile>Microsoft.Office.Visio.Server.dll-help.xml</ps:HelpFile>
      <ps:FeatureDependencyId>5FE8E789-D1B7-44B3-B634-419C531CFDCA</ps:FeatureDependencyId>
    </ps:Cmdlet>
    <ps:Cmdlet>
      <ps:VerbName>Get-SPVisioServiceApplication</ps:VerbName>
      <ps:ClassName>Microsoft.Office.Visio.Server.Cmdlet.GetSPVisioServiceApplication</ps:ClassName>
      <ps:HelpFile>Microsoft.Office.Visio.Server.dll-help.xml</ps:HelpFile>
      <ps:FeatureDependencyId>5FE8E789-D1B7-44B3-B634-419C531CFDCA</ps:FeatureDependencyId>
    </ps:Cmdlet>
    <ps:Cmdlet>
      <ps:VerbName>Set-SPVisioServiceApplication</ps:VerbName>
      <ps:ClassName>Microsoft.Office.Visio.Server.Cmdlet.SetSPVisioServiceApplication</ps:ClassName>
      <ps:HelpFile>Microsoft.Office.Visio.Server.dll-help.xml</ps:HelpFile>
      <ps:FeatureDependencyId>5FE8E789-D1B7-44B3-B634-419C531CFDCA</ps:FeatureDependencyId>
    </ps:Cmdlet>
    <ps:Cmdlet>
      <ps:VerbName>New-SPVisioServiceApplication</ps:VerbName>
      <ps:ClassName>Microsoft.Office.Visio.Server.Cmdlet.NewSPVisioServiceApplication</ps:ClassName>
      <ps:HelpFile>Microsoft.Office.Visio.Server.dll-help.xml</ps:HelpFile>
      <ps:FeatureDependencyId>5FE8E789-D1B7-44B3-B634-419C531CFDCA</ps:FeatureDependencyId>
    </ps:Cmdlet>
    <ps:Cmdlet>
      <ps:VerbName>Get-SPVisioServiceApplicationProxy</ps:VerbName>
      <ps:ClassName>Microsoft.Office.Visio.Server.Cmdlet.GetSPVisioServiceApplicationProxy</ps:ClassName>
      <ps:HelpFile>Microsoft.Office.Visio.Server.dll-help.xml</ps:HelpFile>
      <ps:FeatureDependencyId>5FE8E789-D1B7-44B3-B634-419C531CFDCA</ps:FeatureDependencyId>
    </ps:Cmdlet>
    <ps:Cmdlet>
      <ps:VerbName>New-SPVisioServiceApplicationProxy</ps:VerbName>
      <ps:ClassName>Microsoft.Office.Visio.Server.Cmdlet.NewSPVisioServiceApplicationProxy</ps:ClassName>
      <ps:HelpFile>Microsoft.Office.Visio.Server.dll-help.xml</ps:HelpFile>
      <ps:FeatureDependencyId>5FE8E789-D1B7-44B3-B634-419C531CFDCA</ps:FeatureDependencyId>
    </ps:Cmdlet>
  </ps:Assembly>
</ps:Config>
