<?xml version='1.0'?>
<!-- Copyright (c) Microsoft Corporation. All rights reserved. -->
<ps:Config xmlns:ps="urn:Microsoft.SharePoint.PowerShell"
			xmlns:xsi="http://www.w3.org/2001/XMLSchema-instance"
			xsi:schemaLocation="urn:Microsoft.SharePoint.PowerShell SPCmdletSchema.xsd">
	<ps:Assembly Name="Microsoft.Office.Word.Server, Version=16.0.0.0, Culture=neutral, PublicKeyToken=71e9bce111e9429c">
		<ps:Cmdlet>
			<ps:VerbName>Set-SPWordConversionServiceApplication</ps:VerbName>
			<ps:ClassName>Microsoft.Office.Word.Server.Powershell.ServiceAppSet</ps:ClassName>
			<ps:HelpFile>Microsoft.Office.Word.Server.dll-Help.xml</ps:HelpFile>
		</ps:Cmdlet>
		<ps:Cmdlet>
			<ps:VerbName>New-SPWordConversionServiceApplication</ps:VerbName>
			<ps:ClassName>Microsoft.Office.Word.Server.Powershell.ServiceAppNew</ps:ClassName>
			<ps:HelpFile>Microsoft.Office.Word.Server.dll-Help.xml</ps:HelpFile>
		</ps:Cmdlet>
		<ps:Cmdlet>
			<ps:VerbName>Remove-SPWordConversionServiceJobHistory</ps:VerbName>
			<ps:ClassName>Microsoft.Office.Word.Server.Powershell.JobHistoryRemove</ps:ClassName>
			<ps:HelpFile>Microsoft.Office.Word.Server.dll-Help.xml</ps:HelpFile>
		</ps:Cmdlet>
	</ps:Assembly>
</ps:Config>
