<?xml version='1.0'?>
<!-- Copyright (c) Microsoft Corporation. All rights reserved. -->
<ps:Config xmlns:ps="urn:Microsoft.SharePoint.PowerShell"
            xmlns:xsi="http://www.w3.org/2001/XMLSchema-instance"
            xsi:schemaLocation="urn:Microsoft.SharePoint.PowerShell SPCmdletSchema.xsd">
    <ps:Assembly Name="Microsoft.SharePoint.Translation, Version=16.0.0.0, Culture=neutral, PublicKeyToken=71e9bce111e9429c">
        <ps:Cmdlet>
            <ps:VerbName>Set-SPTranslationThrottlingSetting</ps:VerbName>
            <ps:ClassName>Microsoft.SharePoint.Translation.Powershell.TranslationThrottlingSettingsSet</ps:ClassName>
            <ps:HelpFile>Microsoft.SharePoint.Translation.dll-Help.xml</ps:HelpFile>
        </ps:Cmdlet>
        <ps:Cmdlet>
            <ps:VerbName>Get-SPTranslationThrottlingSetting</ps:VerbName>
            <ps:ClassName>Microsoft.SharePoint.Translation.Powershell.TranslationThrottlingSettingsGet</ps:ClassName>
            <ps:HelpFile>Microsoft.SharePoint.Translation.dll-Help.xml</ps:HelpFile>
        </ps:Cmdlet>
    </ps:Assembly>
</ps:Config>
