<?xml version="1.0" encoding="utf-8" ?>
<ps:Config xmlns:ps="urn:Microsoft.SharePoint.PowerShell"
           xmlns:xsi="http://www.w3.org/2001/XMLSchema-instance"
           xsi:schemaLocation="urn:Microsoft.SharePoint.PowerShell  SPCmdletSchema.xsd">
  <ps:Assembly Name="Nintex.Live.SharePoint, Version=1.0.0.0, Culture=neutral, PublicKeyToken=c52d764dcf7ec883">
    <ps:Cmdlet>
      <ps:VerbName>Install-ExternalPlatform</ps:VerbName>
      <ps:ClassName>Nintex.Live.SharePoint.PowerShell.Install</ps:ClassName>
      <ps:HelpFile>Nintex.Live.PowerShell.Commands.HelpFile.xml</ps:HelpFile>
    </ps:Cmdlet>
    <ps:Cmdlet>
      <ps:VerbName>Uninstall-ExternalPlatform</ps:VerbName>
      <ps:ClassName>Nintex.Live.SharePoint.PowerShell.Uninstall</ps:ClassName>
      <ps:HelpFile>Nintex.Live.PowerShell.Commands.HelpFile.xml</ps:HelpFile>
    </ps:Cmdlet>
  </ps:Assembly>
</ps:Config>
