<?xml version="1.0" encoding="utf-8" ?>
<ps:Config xmlns:ps="urn:Microsoft.SharePoint.PowerShell"
           xmlns:xsi="http://www.w3.org/2001/XMLSchema-instance"
           xsi:schemaLocation="urn:Microsoft.SharePoint.PowerShell  SPCmdletSchema.xsd">
  <ps:Assembly Name="Nintex.Forms.SharePoint, Version=1.0.0.0, Culture=neutral, PublicKeyToken=c52d764dcf7ec883">
    <ps:Cmdlet>
      <ps:VerbName>Install-NFService</ps:VerbName>
      <ps:ClassName>Nintex.Forms.SharePoint.PowerShell.Commands.Install</ps:ClassName>
      <ps:HelpFile>Nintex.Forms.PowerShell.Commands.HelpFile.xml</ps:HelpFile>
    </ps:Cmdlet>
    <ps:Cmdlet>
      <ps:VerbName>Upgrade-NFService</ps:VerbName>
      <ps:ClassName>Nintex.Forms.SharePoint.PowerShell.Commands.Upgrade</ps:ClassName>
      <ps:HelpFile>Nintex.Forms.PowerShell.Commands.HelpFile.xml</ps:HelpFile>
    </ps:Cmdlet>
    <ps:Cmdlet>
      <ps:VerbName>Add-InlineFunction</ps:VerbName>
      <ps:ClassName>Nintex.Forms.SharePoint.PowerShell.Commands.AddInlineFunctionCommand</ps:ClassName>
      <ps:HelpFile>Nintex.Forms.PowerShell.Commands.HelpFile.xml</ps:HelpFile>
    </ps:Cmdlet>
    <ps:Cmdlet>
      <ps:VerbName>Remove-InlineFunction</ps:VerbName>
      <ps:ClassName>Nintex.Forms.SharePoint.PowerShell.Commands.RemoveInlineFunctionCommand</ps:ClassName>
      <ps:HelpFile>Nintex.Forms.PowerShell.Commands.HelpFile.xml</ps:HelpFile>
    </ps:Cmdlet>
    <ps:Cmdlet>
      <ps:VerbName>Show-InlineFunctions</ps:VerbName>
      <ps:ClassName>Nintex.Forms.SharePoint.PowerShell.Commands.ShowInlineFunctionsCommand</ps:ClassName>
      <ps:HelpFile>Nintex.Forms.PowerShell.Commands.HelpFile.xml</ps:HelpFile>
    </ps:Cmdlet>
    <ps:Cmdlet>
      <ps:VerbName>Show-RuntimeFunctions</ps:VerbName>
      <ps:ClassName>Nintex.Forms.SharePoint.PowerShell.Commands.ShowRuntimeFunctionsCommand</ps:ClassName>
      <ps:HelpFile>Nintex.Forms.PowerShell.Commands.HelpFile.xml</ps:HelpFile>
    </ps:Cmdlet>
    <ps:Cmdlet>
      <ps:VerbName>Add-FormControl</ps:VerbName>
      <ps:ClassName>Nintex.Forms.SharePoint.PowerShell.Commands.AddFormControlCommand</ps:ClassName>
      <ps:HelpFile>Nintex.Forms.PowerShell.Commands.HelpFile.xml</ps:HelpFile>
    </ps:Cmdlet>
    <ps:Cmdlet>
      <ps:VerbName>Update-NFSiteId</ps:VerbName>
      <ps:ClassName>Nintex.Forms.SharePoint.PowerShell.Commands.UpdateSiteIdCommand</ps:ClassName>
      <ps:HelpFile>Nintex.Forms.PowerShell.Commands.HelpFile.xml</ps:HelpFile>
    </ps:Cmdlet>
    <ps:Cmdlet>
      <ps:VerbName>Remove-FormControl</ps:VerbName>
      <ps:ClassName>Nintex.Forms.SharePoint.PowerShell.Commands.RemoveFormControlCommand</ps:ClassName>
      <ps:HelpFile>Nintex.Forms.PowerShell.Commands.HelpFile.xml</ps:HelpFile>
    </ps:Cmdlet>
    <ps:Cmdlet>
      <ps:VerbName>Deactivate-NFOrphanedLiveAndMobileForms</ps:VerbName>
      <ps:ClassName>Nintex.Forms.SharePoint.PowerShell.Commands.DeactivateOrphanedLiveAndMobileForms</ps:ClassName>
      <ps:HelpFile>Nintex.Forms.PowerShell.Commands.HelpFile.xml</ps:HelpFile>
    </ps:Cmdlet>
    <ps:Cmdlet>
      <ps:VerbName>Update-NFLicense</ps:VerbName>
      <ps:ClassName>Nintex.Forms.SharePoint.PowerShell.Commands.UpdateLicense</ps:ClassName>
      <ps:HelpFile>Nintex.Forms.PowerShell.Commands.HelpFile.xml</ps:HelpFile>
    </ps:Cmdlet>
    <ps:Cmdlet>
      <ps:VerbName>Create-NFDatabase</ps:VerbName>
      <ps:ClassName>Nintex.Forms.SharePoint.PowerShell.Commands.CreateDatabase</ps:ClassName>
      <ps:HelpFile>Nintex.Forms.PowerShell.Commands.HelpFile.xml</ps:HelpFile>
    </ps:Cmdlet>
    <ps:Cmdlet>
      <ps:VerbName>Update-NFMobileRelay</ps:VerbName>
      <ps:ClassName>Nintex.Forms.SharePoint.PowerShell.Commands.UpdateMobileRelay</ps:ClassName>
      <ps:HelpFile>Nintex.Forms.PowerShell.Commands.HelpFile.xml</ps:HelpFile>
    </ps:Cmdlet>
  </ps:Assembly>
</ps:Config>
